{
  "schema_version": "1",
  "occurrence_id": "PD-2026-0051",
  "created_at": "2026-10-16T09:42:10Z",
  "engine_version": "0.1.0",
  "repo": "gagan046-dev/pipelinedoctor",
  "run": {
    "id": 18400005100,
    "run_number": 91,
    "run_attempt": 1,
    "workflow_name": "Demo CI",
    "workflow_path": ".github/workflows/demo-ci.yml",
    "event": "pull_request",
    "head_branch": "break/test-202610160938",
    "head_sha": "183c1334e3f25619ba816eb46dacc3b542405502",
    "html_url": "https://github.com/gagan046-dev/pipelinedoctor/actions/runs/18400005100",
    "conclusion": "failure",
    "created_at": "2026-10-16T09:39:10Z",
    "updated_at": "2026-10-16T09:41:50Z"
  },
  "pull_request": {
    "number": 31,
    "html_url": "https://github.com/gagan046-dev/pipelinedoctor/pull/31"
  },
  "failed_job": {
    "id": 52000005101,
    "name": "quality / test (ubuntu-latest, 3.12)",
    "html_url": "https://github.com/gagan046-dev/pipelinedoctor/actions/runs/18400005100/job/52000005101"
  },
  "other_failed_jobs": [],
  "failed_step": {
    "number": 5,
    "name": "Run tests"
  },
  "timeline": [
    {
      "number": 1,
      "name": "Set up job",
      "conclusion": "success",
      "started_at": "2026-10-16T09:39:10Z",
      "completed_at": "2026-10-16T09:39:12Z"
    },
    {
      "number": 2,
      "name": "Run actions/checkout",
      "conclusion": "success",
      "started_at": "2026-10-16T09:39:12Z",
      "completed_at": "2026-10-16T09:39:15Z"
    },
    {
      "number": 3,
      "name": "Set up Python",
      "conclusion": "success",
      "started_at": "2026-10-16T09:39:15Z",
      "completed_at": "2026-10-16T09:39:21Z"
    },
    {
      "number": 4,
      "name": "Install dependencies",
      "conclusion": "success",
      "started_at": "2026-10-16T09:39:21Z",
      "completed_at": "2026-10-16T09:39:45Z"
    },
    {
      "number": 5,
      "name": "Run tests",
      "conclusion": "failure",
      "started_at": "2026-10-16T09:39:45Z",
      "completed_at": "2026-10-16T09:40:03Z"
    },
    {
      "number": 6,
      "name": "Upload coverage",
      "conclusion": "skipped",
      "started_at": "2026-10-16T09:40:03Z",
      "completed_at": "2026-10-16T09:40:03Z"
    },
    {
      "number": 7,
      "name": "Post Run actions/checkout",
      "conclusion": "skipped",
      "started_at": "2026-10-16T09:40:03Z",
      "completed_at": "2026-10-16T09:40:03Z"
    },
    {
      "number": 8,
      "name": "Complete job",
      "conclusion": "skipped",
      "started_at": "2026-10-16T09:40:03Z",
      "completed_at": "2026-10-16T09:40:03Z"
    }
  ],
  "category": "test",
  "summary": "test_total_with_tax fails: expected 107.00, got 106.00.",
  "probable_cause": "invoicer.totals.apply_tax() quantizes the net amount to whole units before multiplying by the tax rate, so 99.50 at 7.5% becomes 106.00 instead of 107.00. The test expectation is correct; the rounding happens one step too early.",
  "evidence": [
    {
      "exhibit": "A",
      "line": 812,
      "text": "E       AssertionError: assert Decimal('106.00') == Decimal('107.00')",
      "why": "The failing assertion and both values."
    },
    {
      "exhibit": "B",
      "line": 798,
      "text": "    net = amount.quantize(Decimal(\"1\"), rounding=ROUND_HALF_UP)",
      "why": "Rounding to whole units happens before the tax multiplication."
    },
    {
      "exhibit": "C",
      "line": 841,
      "text": "FAILED demo/tests/test_totals.py::test_total_with_tax - AssertionError",
      "why": "pytest summary naming the single failing test."
    }
  ],
  "recommended_actions": [
    {
      "id": "R1",
      "action": "Quantize after applying the tax rate in apply_tax(), to two decimal places.",
      "command": "python -m pytest demo/tests/test_totals.py -k tax -q"
    },
    {
      "id": "R2",
      "action": "Add a test case with a fractional net amount so early rounding is caught again.",
      "command": null
    }
  ],
  "verification": [
    "Re-run Demo CI; the quality / test legs on 3.11 and 3.12 are green.",
    "Coverage stays at or above 90%."
  ],
  "confidence": 0.86,
  "confidence_grade": "A",
  "source": "llm",
  "pre_classification": {
    "category": "test",
    "rule_id": "pytest-assertion",
    "confidence": 0.8
  },
  "llm": {
    "model": "openrouter/nvidia/nemotron-3-super-120b-a12b:free",
    "prompt_id": "diagnose",
    "prompt_version": "v1",
    "prompt_sha256": "d39585f8c3f52e057438a381ac2acbae1d55524ce362bb3b1afd4d18cc39d84b",
    "attempts": [
      {
        "model": "openrouter/nvidia/nemotron-3-super-120b-a12b:free",
        "outcome": "ok",
        "latency_ms": 4210
      }
    ],
    "latency_ms": 4210,
    "input_tokens": 3120,
    "output_tokens": 410,
    "cost_usd": 0.0
  },
  "log_window": {
    "total_lines": 1290,
    "excerpt_lines": 212,
    "ranges": [
      [
        795,
        1290
      ]
    ],
    "redactions": 0
  },
  "warnings": []
}
