{
  "schema_version": "1",
  "occurrence_id": "PD-2026-0042",
  "created_at": "2026-10-09T08:58:12Z",
  "engine_version": "0.1.0",
  "repo": "gagan046-dev/pipelinedoctor",
  "run": {
    "id": 18400004200,
    "run_number": 82,
    "run_attempt": 1,
    "workflow_name": "Demo CI",
    "workflow_path": ".github/workflows/demo-ci.yml",
    "event": "pull_request",
    "head_branch": "break/timeout-202610090851",
    "head_sha": "ae44e8cc153cb128e982a7360b5171bdaed69d3c",
    "html_url": "https://github.com/gagan046-dev/pipelinedoctor/actions/runs/18400004200",
    "conclusion": "failure",
    "created_at": "2026-10-09T08:55:12Z",
    "updated_at": "2026-10-09T08:57:52Z"
  },
  "pull_request": {
    "number": 24,
    "html_url": "https://github.com/gagan046-dev/pipelinedoctor/pull/24"
  },
  "failed_job": {
    "id": 52000004201,
    "name": "integration",
    "html_url": "https://github.com/gagan046-dev/pipelinedoctor/actions/runs/18400004200/job/52000004201"
  },
  "other_failed_jobs": [],
  "failed_step": {
    "number": 6,
    "name": "Run integration tests"
  },
  "timeline": [
    {
      "number": 1,
      "name": "Set up job",
      "conclusion": "success",
      "started_at": "2026-10-09T08:55:12Z",
      "completed_at": "2026-10-09T08:55:14Z"
    },
    {
      "number": 2,
      "name": "Initialize containers",
      "conclusion": "success",
      "started_at": "2026-10-09T08:55:14Z",
      "completed_at": "2026-10-09T08:55:29Z"
    },
    {
      "number": 3,
      "name": "Run actions/checkout",
      "conclusion": "success",
      "started_at": "2026-10-09T08:55:29Z",
      "completed_at": "2026-10-09T08:55:31Z"
    },
    {
      "number": 4,
      "name": "Set up Python",
      "conclusion": "success",
      "started_at": "2026-10-09T08:55:31Z",
      "completed_at": "2026-10-09T08:55:36Z"
    },
    {
      "number": 5,
      "name": "Install dependencies",
      "conclusion": "success",
      "started_at": "2026-10-09T08:55:36Z",
      "completed_at": "2026-10-09T08:55:56Z"
    },
    {
      "number": 6,
      "name": "Run integration tests",
      "conclusion": "failure",
      "started_at": "2026-10-09T08:55:56Z",
      "completed_at": "2026-10-09T08:58:56Z"
    },
    {
      "number": 7,
      "name": "Stop containers",
      "conclusion": "skipped",
      "started_at": "2026-10-09T08:58:56Z",
      "completed_at": "2026-10-09T08:58:56Z"
    },
    {
      "number": 8,
      "name": "Complete job",
      "conclusion": "skipped",
      "started_at": "2026-10-09T08:58:56Z",
      "completed_at": "2026-10-09T08:58:56Z"
    }
  ],
  "category": "flaky",
  "summary": "The integration step hit its 3-minute timeout while test_slow_lock was still sleeping.",
  "probable_cause": "No assertion failed: the step was cancelled by timeout-minutes: 3 while test_store_integration.py::test_slow_lock waited on a 400-second sleep. Earlier runs of the same commit passed, so this is timing-dependent rather than a logic error.",
  "evidence": [
    {
      "exhibit": "A",
      "line": 121,
      "text": "##[error]The action 'Run integration tests' has timed out after 3 minutes.",
      "why": "Runner cancelled the step."
    },
    {
      "exhibit": "B",
      "line": 118,
      "text": "demo/tests/test_store_integration.py::test_slow_lock ",
      "why": "Last test that started; it never finished."
    }
  ],
  "recommended_actions": [
    {
      "id": "R1",
      "action": "Replace the fixed sleep in test_slow_lock with a lock wait that has a short timeout.",
      "command": null
    },
    {
      "id": "R2",
      "action": "Re-run only the failed job to confirm it is timing-related.",
      "command": "gh run rerun 18400004200 --failed"
    }
  ],
  "verification": [
    "Run integration tests completes in under 60 seconds on three consecutive runs."
  ],
  "confidence": 0.64,
  "confidence_grade": "B",
  "source": "llm",
  "pre_classification": {
    "category": "flaky",
    "rule_id": "step-timeout",
    "confidence": 0.7
  },
  "llm": {
    "model": "openrouter/nvidia/nemotron-3-super-120b-a12b:free",
    "prompt_id": "diagnose",
    "prompt_version": "v1",
    "prompt_sha256": "d39585f8c3f52e057438a381ac2acbae1d55524ce362bb3b1afd4d18cc39d84b",
    "attempts": [
      {
        "model": "openrouter/nvidia/nemotron-3-super-120b-a12b:free",
        "outcome": "ok",
        "latency_ms": 7710
      }
    ],
    "latency_ms": 7710,
    "input_tokens": 1880,
    "output_tokens": 362,
    "cost_usd": 0.0
  },
  "log_window": {
    "total_lines": 128,
    "excerpt_lines": 128,
    "ranges": [
      [
        115,
        128
      ]
    ],
    "redactions": 0
  },
  "warnings": []
}
